{
  "$schema": "http://json-schema.org/draft-07/schema#",
  "$id": "tools/agent/schemas/task.schema.json",
  "title": "Noctune Agent Task",
  "description": "A single task entry in the agent queue. Validated by the runner before execution.",
  "type": "object",
  "required": ["id", "type", "title", "priority", "status", "files_allowed", "files_reference", "acceptance"],
  "properties": {
    "id": {
      "type": "string",
      "description": "Unique task identifier, e.g. q1b-queue-seed",
      "pattern": "^q[0-9]+[-.][a-z]+[-][a-z0-9_-]+$"
    },
    "type": {
      "type": "string",
      "enum": ["bugfix", "feature", "content", "hud", "perf", "test", "refactor", "docs", "chore"],
      "description": "Task type — determines prompt template and acceptance schema"
    },
    "title": {
      "type": "string",
      "description": "Short imperative summary under 72 characters",
      "maxLength": 72
    },
    "description": {
      "type": "string",
      "description": "Detailed description of what the task should accomplish"
    },
    "priority": {
      "type": "integer",
      "description": "Priority score 0–100. Higher = more urgent. Picker returns highest first.",
      "minimum": 0,
      "maximum": 100
    },
    "status": {
      "type": "string",
      "enum": ["READY", "in_progress", "done", "needs_rework", "needs_split", "needs_expansion"],
      "description": "Task lifecycle state"
    },
    "files_allowed": {
      "type": "array",
      "items": {
        "type": "string",
        "description": "File path relative to repo root that this task may modify"
      },
      "minItems": 1
    },
    "files_reference": {
      "type": "array",
      "items": {
        "type": "string",
        "description": "File path relative to repo root that this task may read but not modify"
      },
      "default": []
    },
    "acceptance": {
      "type": "array",
      "items": {
        "type": "string"
      },
      "minItems": 1,
      "description": "Acceptance criteria — each line is a checkable condition"
    },
    "checklist_items": {
      "type": "array",
      "items": {
        "type": "string"
      },
      "description": "Checklist item IDs to tick on successful completion, e.g. [\"q1-queue-seed\"]"
    },
    "intentionally_changed_views": {
      "type": "array",
      "items": {
        "type": "string"
      },
      "description": "Screenshot view names intentionally changed by this task (screenshot diff exemption)",
      "default": []
    },
    "max_loc": {
      "type": "integer",
      "description": "Maximum lines of code change allowed per task type limits",
      "default": 300
    },
    "max_files": {
      "type": "integer",
      "description": "Maximum number of files this task may touch",
      "default": 5
    },
    "needs_split": {
      "type": "boolean",
      "description": "If true, curator must split before execution",
      "default": false
    },
    "created_at": {
      "type": "string",
      "format": "date-time",
      "description": "ISO 8601 timestamp of creation"
    },
    "updated_at": {
      "type": "string",
      "format": "date-time",
      "description": "ISO 8601 timestamp of last status change"
    }
  },
  "additionalProperties": false
}
